{
  "format": "save-one-stroke-level",
  "version": 1,
  "chapter": "入门",
  "id": 1,
  "title": "少了一条腿",
  "tag": "入门 · 找个落脚点",
  "brief": "右腿请假了。补一笔，让阿稳坐满 5 秒。",
  "condition": "阿稳坐在椅子中间，右侧需要一个落脚点。",
  "quip": "我叫阿稳，不代表我真的稳。",
  "success": "腿回来了！我的工伤申请撤回。",
  "failure": "椅子：今天先坐到这里。",
  "ink": 185,
  "gold": 145,
  "chair": [
    {
      "x": 234,
      "y": 251,
      "w": 184,
      "h": 18,
      "kind": "seat"
    },
    {
      "x": 247,
      "y": 265,
      "w": 14,
      "h": 135,
      "kind": "leg"
    }
  ],
  "terrain": [
    {
      "x": 20,
      "y": 400,
      "w": 680,
      "h": 90
    }
  ],
  "load": {
    "x": 341,
    "mass": 14
  },
  "hint": [
    "先看看哪一边没有椅脚：人会往没有支撑的一侧倒。",
    "从椅面右侧向实心地面画一条腿。线要碰到木椅，末端要落地。"
  ],
  "labels": [
    {
      "x": 467,
      "y": 285,
      "text": "右腿去哪了？",
      "to": [
        404,
        328
      ]
    }
  ]
}
