{
  "format": "save-one-stroke-level",
  "version": 1,
  "chapter": "入门",
  "id": 4,
  "title": "别吵醒老板",
  "tag": "绕行 · 一笔转个弯",
  "brief": "老板在下面睡觉。老板是一只猫，碰到就扣罐头。",
  "condition": "粉色区域不能画，也不能在试坐时碰到；绕上方再落地。",
  "quip": "人可以摔，老板不能醒。",
  "success": "人稳，猫睡，罐头预算保住了。",
  "failure": "老板：刚刚是谁动了我的午睡？",
  "ink": 235,
  "gold": 205,
  "chair": [
    {
      "x": 234,
      "y": 251,
      "w": 184,
      "h": 18,
      "kind": "seat"
    },
    {
      "x": 247,
      "y": 265,
      "w": 14,
      "h": 135,
      "kind": "leg"
    }
  ],
  "terrain": [
    {
      "x": 20,
      "y": 400,
      "w": 680,
      "h": 90
    }
  ],
  "load": {
    "x": 384,
    "mass": 17
  },
  "forbidden": {
    "x": 350,
    "y": 316,
    "w": 138,
    "h": 84
  },
  "hint": [
    "左边的窄支撑托不住靠右坐的人；猫的整个粉色领地都不能碰。",
    "一笔可以拐弯！从椅面右端向右伸过粉色区域，再向下接地。边缘留一点空隙。"
  ],
  "labels": [
    {
      "x": 518,
      "y": 280,
      "text": "嘘，绕一下",
      "to": [
        502,
        329
      ]
    }
  ]
}
