{
  "format": "save-one-stroke-level",
  "version": 1,
  "chapter": "挑战",
  "id": 8,
  "title": "高低双岛",
  "tag": "挑战 Ⅲ · 不对称落脚",
  "brief": "腿没了，地也碎了。仅剩的两个小平台还不一样高。",
  "condition": "两脚分别落在左右小岛，右岛较高。照搬对称支架会悬空或钻进实体。",
  "quip": "这工位的通勤距离有点远。",
  "success": "高低脚，各司其职。这叫因地制宜。",
  "failure": "悬空那一脚，暂时不算员工。",
  "ink": 412,
  "gold": 365,
  "chair": [{"x":234,"y":251,"w":184,"h":18,"kind":"seat"}],
  "terrain": [{"x":162,"y":400,"w":64,"h":90},{"x":467,"y":342,"w":63,"h":148}],
  "gap": [226,467],
  "load": {"x":365,"mass":17},
  "hint": ["只有两个窄平台承重，中间都是洞。左脚更长、右脚更短，不能照搬上一关的左右对称。", "从左侧低平台起笔，碰到椅面后斜落到右侧高平台顶上。脚尖都放在平台中间一点，别蹭边。"],
  "labels": [{"x":534,"y":299,"text":"右边更高","to":[497,338]},{"x":76,"y":341,"text":"左边更低","to":[193,395]}]
}
