{
  "format": "save-one-stroke-level",
  "version": 1,
  "chapter": "入门",
  "id": 3,
  "title": "地板也请假",
  "tag": "空间 · 跨过空洞",
  "brief": "看起来能落地的地方，今天不一定有地。",
  "condition": "虚线下面是空洞；跨到右边的实心地板。",
  "quip": "物业说，这是开放式地下室。",
  "success": "成功跨过装修坑。物业给你点了赞。",
  "failure": "你补了椅子，没补上物业的良心。",
  "ink": 185,
  "gold": 157,
  "chair": [
    {
      "x": 234,
      "y": 251,
      "w": 184,
      "h": 18,
      "kind": "seat"
    },
    {
      "x": 247,
      "y": 265,
      "w": 14,
      "h": 135,
      "kind": "leg"
    }
  ],
  "terrain": [
    {
      "x": 20,
      "y": 400,
      "w": 294,
      "h": 90
    },
    {
      "x": 454,
      "y": 400,
      "w": 246,
      "h": 90
    }
  ],
  "load": {
    "x": 348,
    "mass": 14
  },
  "gap": [
    314,
    454
  ],
  "hint": [
    "笔画不会钉在空气里。洞上的“地面线”只是警示，不会托住椅子。",
    "从椅面右端斜着伸到洞右边，脚尖落在实心地板上。"
  ],
  "labels": [
    {
      "x": 480,
      "y": 321,
      "text": "找实心的那边",
      "to": [
        472,
        396
      ]
    }
  ]
}
