{
  "format": "save-one-stroke-level",
  "version": 1,
  "chapter": "入门",
  "id": 5,
  "title": "借个台阶",
  "tag": "省墨 · 短也有短的好",
  "brief": "最后一点墨水，不够落地？换个地方落脚。",
  "condition": "台阶也能承重。用短线接住右侧，不必够到最下方。",
  "quip": "预算到这里了，智慧还没到。",
  "success": "这么省？财务想把你也招进去。",
  "failure": "差的不是墨水，是一个合适的台阶。",
  "ink": 103,
  "gold": 82,
  "chair": [
    {
      "x": 234,
      "y": 251,
      "w": 184,
      "h": 18,
      "kind": "seat"
    },
    {
      "x": 247,
      "y": 265,
      "w": 14,
      "h": 135,
      "kind": "leg"
    }
  ],
  "terrain": [
    {
      "x": 20,
      "y": 400,
      "w": 680,
      "h": 90
    },
    {
      "x": 405,
      "y": 326,
      "w": 160,
      "h": 74,
      "step": true
    }
  ],
  "load": {
    "x": 350,
    "mass": 14
  },
  "hint": [
    "直接画到地面会用完墨水。注意右侧台阶的上表面。",
    "从椅面右端接到台阶顶上，留出一点向右的距离；稳住不靠线长。"
  ],
  "labels": [
    {
      "x": 480,
      "y": 281,
      "text": "这里也能借力",
      "to": [
        448,
        323
      ]
    }
  ]
}
