{
  "format": "save-one-stroke-level",
  "version": 1,
  "chapter": "挑战",
  "id": 9,
  "title": "双猫夹击",
  "tag": "挑战 Ⅳ · 窄通道与跨坑",
  "brief": "一只猫守下面，一只猫守右边。终点地板还在更远处。",
  "condition": "两片粉色区域都不能碰；从两猫之间向下绕，再跨到最右边地面。",
  "quip": "老板和总监，今天一起监工。",
  "success": "夹缝求生成功，两位领导继续睡。",
  "failure": "有一位领导，对你的笔迹有意见。",
  "ink": 335,
  "gold": 302,
  "chair": [{"x":234,"y":251,"w":184,"h":18,"kind":"seat"},{"x":247,"y":265,"w":14,"h":135,"kind":"leg"}],
  "terrain": [{"x":20,"y":400,"w":294,"h":90},{"x":578,"y":400,"w":122,"h":90}],
  "gap": [314,578],
  "load": {"x":396,"mass":20},
  "forbiddenZones": [{"x":350,"y":307,"w":91,"h":93,"label":"老板"},{"x":478,"y":250,"w":92,"h":78,"label":"总监"}],
  "hint": ["只到两只猫之间还不够：下面是洞。右侧实心地板比上面的猫区还靠右。", "从椅面右侧进入两猫之间的竖缝，往下绕过上方猫区的底边，再向右跨坑，最后向下落地。留出一个笔尖宽的安全距离。"],
  "labels": [{"x":569,"y":206,"text":"还得继续向右","to":[600,356]}]
}
