{
  "format": "save-one-stroke-level",
  "version": 1,
  "chapter": "入门",
  "id": 2,
  "title": "胖橘偏心",
  "tag": "重心 · 撑得更开",
  "brief": "阿稳非要抱猫坐边边。这回，有两条腿也会翻。",
  "condition": "人和胖橘都偏右坐，向外扩一扩支撑范围。",
  "quip": "不是我重，是橘势比较严峻。",
  "success": "橘势稳定。猫批准你继续上班。",
  "failure": "猫没胖，是椅子的格局小了。",
  "ink": 185,
  "gold": 150,
  "chair": [
    {
      "x": 234,
      "y": 251,
      "w": 202,
      "h": 18,
      "kind": "seat"
    },
    {
      "x": 247,
      "y": 265,
      "w": 14,
      "h": 135,
      "kind": "leg"
    },
    {
      "x": 345,
      "y": 265,
      "w": 14,
      "h": 135,
      "kind": "leg"
    }
  ],
  "terrain": [
    {
      "x": 20,
      "y": 400,
      "w": 680,
      "h": 90
    }
  ],
  "load": {
    "x": 405,
    "mass": 15,
    "cat": true,
    "catX": 443,
    "catMass": 5
  },
  "hint": [
    "留意箭头：人和猫的重量都压在右侧，已经超出旧椅脚。",
    "在右侧画一条向外张开的斜撑，落点比旧右脚更靠右。不是往左边加固。"
  ],
  "labels": [
    {
      "x": 489,
      "y": 290,
      "text": "重量都在这边 →",
      "to": [
        438,
        253
      ]
    }
  ]
}
