{
  "format": "save-one-stroke-level",
  "version": 1,
  "id": 101,
  "chapter": "挑战",
  "title": "单关文件示例",
  "tag": "离线迭代 · 两端落地",
  "brief": "两条旧腿都不在。一笔能不能同时接住两边？",
  "condition": "从地面起笔也可以，中途接触木椅就会焊牢；左右都要有落脚点。",
  "quip": "带上 JSON，也请带上我的椅腿。",
  "success": "文件可以搬家，阿稳不用搬去地板。",
  "failure": "只救一边，另一边还是会倒。",
  "ink": 345,
  "gold": 310,
  "chair": [{"x":234,"y":251,"w":184,"h":18,"kind":"seat"}],
  "terrain": [{"x":20,"y":400,"w":680,"h":90}],
  "load": {"x":344,"mass":16},
  "hint": ["一笔可以从地面起笔，经过椅面，再落到另一边。", "尖头朝上的帐篷形状可以同时造两只脚，比大方框省墨。"],
  "labels": [{"x":475,"y":292,"text":"两边都要接住","to":[412,351]}]
}
