{
  "format": "save-one-stroke-level",
  "version": 1,
  "chapter": "挑战",
  "id": 7,
  "title": "左右为难",
  "tag": "挑战 Ⅱ · 会换向的穿堂风",
  "brief": "有腿也不保险。先向右吹，再向左吹，没有避风港。",
  "condition": "0.6–2.2 秒向右推，2.4–4.0 秒向左推。只加固一边不够。",
  "quip": "风向变了，工伤方向也变了。",
  "success": "左右都撑开了，风也没你主意正。",
  "failure": "刚防住右边，左边又出事了。",
  "ink": 480,
  "gold": 432,
  "chair": [{"x":234,"y":251,"w":184,"h":18,"kind":"seat"},{"x":247,"y":265,"w":14,"h":135,"kind":"leg"},{"x":389,"y":265,"w":14,"h":135,"kind":"leg"}],
  "terrain": [{"x":20,"y":400,"w":680,"h":90}],
  "load": {"x":340,"mass":16},
  "forces": [
    {"start":600,"end":2200,"fx":0.017,"fy":0,"at":{"x":340,"y":170},"label":"第一阵风 · 向右 →"},
    {"start":2400,"end":4000,"fx":-0.017,"fy":0,"at":{"x":340,"y":170},"label":"风向反转 · ← 向左"}
  ],
  "hint": ["正常坐得住，不代表扛得住横向推力。先观察两阵风的方向，再决定两边的落脚范围。", "用一笔把左右地脚同时向外张开，中途接上椅面。窄窄的直腿不够；向两侧展开的大帐篷更抗风。"],
  "labels": [{"x":478,"y":293,"text":"别只顾一边","to":[454,369]}]
}
