{
  "format": "save-one-stroke-level",
  "version": 1,
  "chapter": "挑战",
  "id": 6,
  "title": "无腿自由人",
  "tag": "挑战 Ⅰ · 一笔造两脚",
  "brief": "这次不是缺一条，是两条腿都跑路了。",
  "condition": "没有任何旧脚。只接一侧会翻，一笔得同时照顾左右两边。",
  "quip": "这不是椅子，这是悬浮工位。",
  "success": "零件全靠画，阿稳全靠你。",
  "failure": "只补了一边，另一边自由了。",
  "ink": 345,
  "gold": 310,
  "chair": [{"x":234,"y":251,"w":184,"h":18,"kind":"seat"}],
  "terrain": [{"x":20,"y":400,"w":680,"h":90}],
  "load": {"x":344,"mass":16},
  "hint": ["一笔不必从木椅开始，中途碰到木椅也会焊牢。两端都能成为落脚点。", "想象一个尖头朝上的帐篷：从一侧地面起笔，经椅面，再落到另一侧。别用费墨的大方框。"],
  "labels": [{"x":475,"y":292,"text":"两边都要救！","to":[412,351]}]
}
